{
  "command": "pybun self update",
  "detail": {
    "channel": "stable",
    "current_version": "0.2.3",
    "dry_run": true,
    "error": null,
    "install_path": null,
    "latest_version": "0.2.3",
    "manifest": null,
    "manifest_error": null,
    "manifest_source": "https://github.com/VOID-TECHNOLOGY-INC/PyBun/releases/latest/download/pybun-release.json",
    "release_url": "https://github.com/VOID-TECHNOLOGY-INC/PyBun/releases/tag/v0.2.3",
    "rollback_performed": false,
    "target": "<target>",
    "update_applied": false,
    "update_available": false
  },
  "diagnostics": [
    {
      "level": "info",
      "message": "Checking for updates on stable channel"
    }
  ],
  "duration_ms": 0,
  "events": [
    {
      "timestamp_ms": 0,
      "type": "command_start"
    },
    {
      "timestamp_ms": 0,
      "type": "command_end"
    }
  ],
  "status": "ok",
  "version": "1"
}